{
  "schemaVersion": 1,
  "id": "de-stroke-014-fresh-001",
  "profile": "de-basisschrift",
  "fixtureClass": "FRESH_NORMATIVE_STRUCTURED_VECTOR_EVIDENCE",
  "semanticFamily": "BOUNDARY_CONDITIONAL_VECTOR",
  "input": {
    "value": {
      "kind": "NUMERIC_SLASH",
      "dependencies": [
        "DE-NUM-001",
        "DE-NUM-002"
      ]
    }
  },
  "expectation": {
    "value": {
      "unicode": "⠐⠂",
      "codepoints": [
        "U+2810",
        "U+2802"
      ],
      "dots": [
        "5",
        "2"
      ],
      "cellCount": 2
    }
  },
  "ruleTrace": {
    "linkedLoweringRuleIds": [
      "DE-STROKE-014"
    ],
    "canonicalSourceRuleIds": [
      "DE-STROKE-014"
    ],
    "canonicalContractPaths": [
      "docs/architecture/phase-15.1f-bskdl-basisschrift-stroke-slash-boundary-contract.json"
    ],
    "canonicalSections": [
      "2.5.2"
    ]
  },
  "normativeProvenance": {
    "authority": {
      "organization": "Brailleschriftkomitee der deutschsprachigen Länder",
      "edition": "2., korrigierte Auflage 2021",
      "url": "https://www.bskdl.org/download/textschrift/bs-2021-07-17-UBP.pdf",
      "sha256": "35F6CD3A8EF07AD33229398E6310DC778046DF23FC13A61F0B7871E288C5D8CE"
    },
    "bindings": [
      {
        "role": "CANONICAL_SOURCE_CONTRACT",
        "path": "docs/architecture/phase-15.1f-bskdl-basisschrift-stroke-slash-boundary-contract.json",
        "byteSha256": "4D5871B65883AA40D49DE44144B2C1D8B2C0E9BFC4800257AAC09ECE8CAF1ABC",
        "canonicalSha256": "500739BC3388FB14AC1DAA5E9F49813536457986165F2B60EE0CDC3556BB7485",
        "jsonPointer": "/rules/13",
        "section": "2.5.2"
      },
      {
        "role": "CANONICAL_RULE",
        "path": "spec/de/rules/records/de-stroke-014.json",
        "byteSha256": "030F4FB8DD495C3CDCEB5D780F2EF63B6E2728DAEF466A571F7F20693506F517",
        "canonicalSha256": "D4F3A37B38CE9DAC97967054FDA1D4D3999668E7015E49BE1E881B57574F3786",
        "section": "2.5.2"
      }
    ],
    "derivation": {
      "method": "EXACT_CANONICAL_SOURCE_VECTOR_WITH_STRUCTURED_PREDICATE_SCENARIO",
      "expectedVectorCanonicalSha256": "8645536C0E4684445109E73ED68719AECDE21899DAFE365FC4A878E5883FF955"
    }
  },
  "executionBoundary": {
    "fixtureGradeNormativeEvidence": true,
    "runtimeConformanceProven": false,
    "runtimeExecutable": false
  }
}
