{
  "schemaVersion": 1,
  "id": "DE-NUM-005-FRESH-001",
  "profile": "de-basisschrift",
  "fixtureClass": "FRESH_NORMATIVE_STRUCTURED_VECTOR_EVIDENCE",
  "semanticFamily": "BOUNDARY_CONDITIONAL_VECTOR",
  "input": {
    "value": {
      "kind": "DIRECT_TEXT",
      "value": ".303"
    }
  },
  "expectation": {
    "value": {
      "kind": "VECTOR_SET",
      "vectors": [
        {
          "field": "expectedBraille",
          "value": {
            "unicode": "⠼⠄⠉⠚⠉",
            "codepoints": [
              "U+283C",
              "U+2804",
              "U+2809",
              "U+281A",
              "U+2809"
            ],
            "dots": [
              "3456",
              "3",
              "14",
              "245",
              "14"
            ],
            "cellCount": 5
          },
          "canonicalSha256": "18DB0C949DC51E45909C2F6C1BF8CA5312632404C80460794AAEC6650E56F767"
        }
      ],
      "behaviorSupplement": null
    }
  },
  "ruleTrace": {
    "linkedLoweringRuleIds": [
      "DE-NUM-005"
    ],
    "canonicalSourceRuleIds": [
      "DE-NUM-005"
    ],
    "canonicalContractPaths": [
      "spec/de/rules/records/de-num-005.json"
    ],
    "canonicalSections": [
      "2.3.1.1"
    ]
  },
  "normativeProvenance": {
    "authority": {
      "organization": "Brailleschriftkomitee der deutschsprachigen Länder",
      "edition": "2., korrigierte Auflage 2021",
      "url": "https://www.bskdl.org/download/textschrift/bs-2021-07-17-UBP.pdf",
      "sha256": "35F6CD3A8EF07AD33229398E6310DC778046DF23FC13A61F0B7871E288C5D8CE"
    },
    "bindings": [
      {
        "role": "CANONICAL_RULE_RECORD",
        "path": "spec/de/rules/records/de-num-005.json",
        "byteSha256": "DA0E10D221CCCAB6D42E348B68A83C5C149B652B336CB7AEBF1A5B6A20DF4848",
        "canonicalSha256": "676FC30BBF58DDF708327F0FFA4E2B4E5BA0246E0721B2535DB88B3220F28A03",
        "section": "2.3.1.1"
      }
    ],
    "derivation": {
      "method": "FRESH_NORMATIVE_BSKDL_SECTION_PLUS_CANONICAL_RULE_ADJUDICATION",
      "expectedVectorCanonicalSha256": "8DE8883AC5AC056F5A42E159EEA39EA40FF7D8B0A98B7DACEC9F39701973351E"
    }
  },
  "executionBoundary": {
    "fixtureGradeNormativeEvidence": true,
    "runtimeConformanceProven": false,
    "runtimeExecutable": false
  }
}
