{
  "schemaVersion": 1,
  "id": "DE-CB-006-FRESH-001",
  "profile": "de-basisschrift",
  "fixtureClass": "FRESH_NORMATIVE_STRUCTURED_VECTOR_EVIDENCE",
  "semanticFamily": "STANDARD_CELL_VECTOR",
  "input": {
    "value": {
      "sourceDots": "18"
    }
  },
  "expectation": {
    "value": {
      "kind": "VECTOR_SET",
      "vectors": [
        {
          "field": "expected",
          "role": "EXPLICIT_EXPECTATION_VECTOR",
          "value": {
            "unicode": "⠠⠁",
            "codepoints": [
              "U+2820",
              "U+2801"
            ],
            "dots": [
              "6",
              "1"
            ],
            "cellCount": 2
          },
          "canonicalSha256": "9FB12F2E799115F6C781D9E2B942CA2327F6983646269AA6F4501DBAC198BAF2"
        }
      ],
      "behaviorSupplement": null
    }
  },
  "ruleTrace": {
    "linkedLoweringRuleIds": [
      "DE-CB-006"
    ],
    "canonicalSourceRuleIds": [
      "DE-CB-006"
    ],
    "canonicalContractPaths": [
      "docs/architecture/phase-15.1l-bskdl-basisschrift-computerbraille-insert-six-dot-transport-contract.json"
    ],
    "canonicalSections": [
      "2.11"
    ]
  },
  "normativeProvenance": {
    "authority": {
      "organization": "Brailleschriftkomitee der deutschsprachigen Länder",
      "edition": "2., korrigierte Auflage 2021",
      "url": "https://www.bskdl.org/download/textschrift/bs-2021-07-17-UBP.pdf",
      "sha256": "35F6CD3A8EF07AD33229398E6310DC778046DF23FC13A61F0B7871E288C5D8CE"
    },
    "bindings": [
      {
        "role": "HISTORICAL_CASE_SOURCE",
        "path": "docs/architecture/phase-15.1l-bskdl-basisschrift-computerbraille-insert-six-dot-transport-contract.json",
        "byteSha256": "F59392260F8DAE433B69B2DC51B83A6CC041E89E6C51E6FAC8F10B9AA0AF50DB",
        "canonicalSha256": "C1B50DB16876747D15B3B441364764CC79849217332D94B8EC42CE2217FEADF7",
        "jsonPointer": "/validationCases/2"
      },
      {
        "role": "CANONICAL_ARCHITECTURE_SOURCE",
        "path": "docs/architecture/phase-15.1l-bskdl-basisschrift-computerbraille-insert-six-dot-transport-contract.json",
        "byteSha256": "F59392260F8DAE433B69B2DC51B83A6CC041E89E6C51E6FAC8F10B9AA0AF50DB",
        "canonicalSha256": "C1B50DB16876747D15B3B441364764CC79849217332D94B8EC42CE2217FEADF7",
        "jsonPointer": "/rules/5",
        "section": "2.11"
      },
      {
        "role": "CANONICAL_RULE_RECORD",
        "path": "spec/de/rules/records/de-cb-006.json",
        "byteSha256": "1CD753493F159267642327D4CBBD0FB451F0C4703834FA6341CCBB721FEDCBD5",
        "canonicalSha256": "A1E4C6A842B704D1E5F41283EAFCA1A161E4640F69A521C068BFAABBBA064DDB"
      }
    ],
    "derivation": {
      "method": "LOSSLESS_CARRY_FORWARD_FROM_ADJUDICATED_HISTORICAL_EVIDENCE",
      "expectedVectorCanonicalSha256": "0D1ADCCB9980BED79B3EC87311695BFA4053FBE83AC159D51A7A9D56B9453A5C"
    }
  },
  "executionBoundary": {
    "fixtureGradeNormativeEvidence": true,
    "runtimeConformanceProven": false,
    "runtimeExecutable": false
  }
}
